{
  "id": "blood-glucose-in-the-sick-dog",
  "title": "Blood glucose in the sick dog",
  "domain": "pathophysiology",
  "reversible": false,
  "status": "draft",
  "last_verified": null,
  "review_interval_months": 24,
  "signoff": {
    "vet": null,
    "physician": null
  },
  "why_this_matters": "Both low and high blood glucose were common in non-diabetic dogs at an emergency room and both were associated with higher mortality, while low glucose as a cause of coma carried a better outlook than other causes, so a glucose check is a cheap, high-yield early test.",
  "what_changes_from_human": [
    {
      "point": "In 660 non-diabetic emergency dogs, hyperglycemia (above 120 mg/dL) was found in 40.1% and hypoglycemia (below 80 mg/dL) in 9.0%; mortality was 33.2% with hyperglycemia and 44.6% with hypoglycemia against 24.9% with normal glucose.",
      "objective_id": "pathophys-gluc-01"
    },
    {
      "point": "In dogs in coma or stupor, hypoglycemia was the cause in 10.7%, and death was less likely when hypoglycemia was the cause than for other causes.",
      "objective_id": "pathophys-gluc-02"
    }
  ],
  "content": {
    "recognition": [
      "TODO: canine glucose reference ranges and thresholds from a source the veterinary reviewer selects; working-dog exertion and fasting glucose (no retrieved source). See the hypoglycemia module for first aid."
    ],
    "management": [],
    "procedure_refs": []
  },
  "takeaway": "Check a dog's blood glucose early in any collapse, seizure or altered mentation: low glucose is a treatable cause, and any abnormal value signals sicker dogs.",
  "sources": [
    {
      "rank": 3,
      "citation": "Hagley SP et al. 2020. Etiology and prognosis for dogs with abnormal blood glucose concentrations evaluated in an emergency room. J Vet Emerg Crit Care.",
      "url": "https://doi.org/10.1111/vec.12996"
    },
    {
      "rank": 3,
      "citation": "Parratt CA et al. 2018. Retrospective characterization of coma and stupor in dogs and cats presenting to a multicenter out-of-hours service (2012-2015): 386 animals. J Vet Emerg Crit Care.",
      "url": "https://doi.org/10.1111/vec.12772"
    },
    {
      "rank": 3,
      "citation": "Verkinderen B, Lane M. 2025. Long-term antiepileptic therapy is often not required in dogs with insulin-induced hypoglycemic seizures: a multicenter retrospective study of 49 dogs. J Am Vet Med Assoc.",
      "url": "https://doi.org/10.2460/javma.25.09.0594"
    }
  ],
  "drug_refs": [],
  "kind": "pathophysiology",
  "compare": [
    {
      "topic": "Abnormal glucose in emergency patients",
      "human": "Stress hyperglycemia is common in critically ill people, and both very low and very high glucose are linked to worse outcomes in people.",
      "canine": "In 660 non-diabetic dogs with glucose measured within 6 hours of arrival, hyperglycemia (above 120 mg/dL, 6.7 mmol/L) occurred in 40.1% and hypoglycemia (below 80 mg/dL, 4.4 mmol/L) in 9.0%. Hyperglycemia was most often linked to gastrointestinal disease, trauma, neoplasia and respiratory disease; hypoglycemia most often to sepsis, gastrointestinal disease and neoplasia. Dogs in shock or with raised lactate had higher glucose. Mortality was 33.2% (hyperglycemia), 44.6% (hypoglycemia) and 24.9% (normal).",
      "implication": "Treat a low or high glucose in a sick dog as a marker of severity and look for the cause; the study's cut-offs are a study definition, not a reference range (human clinical hypoglycemia is commonly defined below about 70 mg/dL).",
      "human_basis": "general-medical-knowledge",
      "source_refs": [
        1
      ]
    },
    {
      "topic": "Hypoglycemia as a cause of coma or stupor",
      "human": "Hypoglycemia is a rapidly reversible cause of altered consciousness that is checked for early in people.",
      "canine": "Among 168 dogs presenting in coma or stupor to a multicenter out-of-hours service, the commonest determined causes were traumatic brain injury (16.0%), hypoglycemia (10.7%), shock (10.1%) and seizure (9.5%). Death was less likely when coma or stupor was attributed to hypoglycemia than for other etiologies; Chihuahuas were overrepresented.",
      "implication": "Always measure glucose in a dog with depressed mentation; it is one of the few causes with a good prognosis.",
      "human_basis": "general-medical-knowledge",
      "source_refs": [
        2
      ]
    },
    {
      "topic": "Insulin-induced hypoglycemic seizures in diabetic dogs",
      "human": "Seizures from insulin-induced hypoglycemia in people are treated by correcting glucose, and long-term antiseizure drugs are not usually needed.",
      "canine": "In 49 dogs with glucose below 80 mg/dL within 12 hours of insulin, 34 had seizures. Seizures were more likely in dogs under 10 kg or over 25 kg. Antiepileptic drugs were used in 7 of 34 dogs and 3 needed long-term therapy; insulin type, amount and time to glucose correction did not differ between seizing and non-seizing dogs.",
      "implication": "A seizing diabetic dog on insulin needs a glucose check and correction; long-term neurological damage or ongoing antiseizure treatment is uncommon.",
      "human_basis": "general-medical-knowledge",
      "source_refs": [
        3
      ]
    }
  ]
}
