{
  "id": "airway",
  "title": "Airway",
  "domain": "trauma",
  "reversible": true,
  "status": "draft",
  "last_verified": null,
  "review_interval_months": 12,
  "signoff": {
    "vet": null,
    "physician": null
  },
  "why_this_matters": "When a dog cannot be intubated and cannot be oxygenated, delay to an emergency front-of-neck airway has been linked to deaths in a small case series; airway skill and timing are the issue, not species-specific anatomy alone [1][2].",
  "what_changes_from_human": [
    {
      "point": "In five small-animal cannot-intubate, cannot-oxygenate cases (3 dogs, 2 cats) all died, and emergency front-of-neck airway access was late, not attempted or not possible in several; the authors argue for early recognition and a defined trigger [1].",
      "objective_id": "airway-01"
    },
    {
      "point": "Brachycephalic dogs in airway crisis who needed immediate intubation had 71% survival to discharge and a 48% complication rate; longer intubation time raised pneumonia risk [3].",
      "objective_id": "airway-02"
    }
  ],
  "content": {
    "recognition": [
      "In healthy anesthetized dogs, final-year students took a median 54 s to intubate versus 12 s for qualified veterinarians; the authors recommend a 55 s supervisor take-over limit and pre-oxygenation to limit hypoxemia [2]. This was an anesthesia setting, not a field emergency.",
      "Brachycephalic obstructive airway syndrome in crisis can require immediate intubation; French Bulldogs regurgitated more often than other brachycephalic breeds [3].",
      "TODO: canine-specific laryngeal exposure landmarks and tube sizing by size or breed. No canine source retrieved for either; do not adapt human tables."
    ],
    "management": [
      "RECOVER 2026: give oxygen to dogs and cats with difficulty breathing or hypoxemia during transport (strong, expert opinion); when monitoring is available, titrate to an SpO2 of 95 to 97% (strong, moderate quality) [4].",
      "Choking, conscious dog or cat, low risk to the rescuer: up to 5 back blows over the caudodorsal thorax, lateral to the spine, then alternative techniques if unsuccessful (strong, very low quality). Unconscious with suspected airway foreign body: no blind finger sweeps (strong, expert opinion); start chest compressions per the out-of-hospital CPR algorithm (strong, very low quality) [4].",
      "Time-limited attempts and early escalation are the lesson from the CICO case series; the authors propose a guideline for emergency front-of-neck access [1].",
      "TODO: reviewer to decide whether emergency surgical airway is in scope for any non-veterinary tier, and the trigger. The retrieved series describes failures and gives no validated technique. No drug or dose is given here.",
      "TODO: supraglottic or blind-insertion devices: one small dog study exists (James 2015, 35 dogs, not retrieved in full) but is not cited."
    ],
    "procedure_refs": []
  },
  "lens": {
    "handler": {
      "do_here": [],
      "leave_for_next": [],
      "transfer_trigger": "TODO: reviewer to set"
    },
    "prehospital_als": {
      "do_here": [],
      "leave_for_next": [],
      "transfer_trigger": "TODO: reviewer to set"
    },
    "flight_cct": {
      "do_here": [],
      "leave_for_next": [],
      "transfer_trigger": "TODO: reviewer to set"
    },
    "human_ed": {
      "do_here": [],
      "leave_for_next": [],
      "transfer_trigger": "TODO: reviewer to set"
    },
    "vet_gp": {
      "do_here": [],
      "leave_for_next": [],
      "transfer_trigger": "TODO: reviewer to set"
    },
    "vet_ed": {
      "do_here": [],
      "leave_for_next": [],
      "transfer_trigger": "TODO: reviewer to set"
    }
  },
  "takeaway": "A dog that cannot be intubated needs a time limit and a plan to escalate early; get a veterinarian with airway skills involved fast.",
  "sources": [
    {
      "rank": 3,
      "citation": "Hardjo S et al. 2022. A proposed guideline for performance of emergency surgical airways in small animals: analysis of five unsuccessfully managed cannot intubate, cannot oxygenate cases. Vet Sci.",
      "url": "https://pubmed.ncbi.nlm.nih.gov/35202292/"
    },
    {
      "rank": 3,
      "citation": "Langton SD, Blevins MB. 2021. The time required to achieve endotracheal intubation in dogs: a comparison of veterinary students and qualified veterinary surgeons. Vet Anaesth Analg.",
      "url": "https://pubmed.ncbi.nlm.nih.gov/34332898/"
    },
    {
      "rank": 3,
      "citation": "Cook LA et al. 2025. Retrospective evaluation of the outcomes of advanced airway management in intubated patients with brachycephalic obstructive airway syndrome: 52 cases (2010-2020). J Small Anim Pract.",
      "url": "https://pubmed.ncbi.nlm.nih.gov/40579826/"
    },
    {
      "rank": 1,
      "citation": "Thawley VJ et al. 2026. RECOVER Guidelines: First Aid in Dogs and Cats. Evidence and knowledge gap analysis with treatment recommendations. J Vet Emerg Crit Care 36(Suppl 1):S3-S35.",
      "url": "https://pubmed.ncbi.nlm.nih.gov/42640821/"
    }
  ],
  "drug_refs": []
}
