{
  "id": "burns",
  "title": "Burns",
  "domain": "trauma",
  "reversible": true,
  "status": "draft",
  "last_verified": null,
  "review_interval_months": 12,
  "signoff": {
    "vet": null,
    "physician": null
  },
  "why_this_matters": "Burns in dogs are uncommon, and only small canine case series were retrieved; heat-related burns can follow sun exposure in hot weather and can accompany heat exhaustion or heatstroke [1].",
  "what_changes_from_human": [
    {
      "point": "A dog's coat can hide burns: in 16 dogs with sun-related dorsal burns, lesions were alopecia, erythema, ulcers, eschar and crusts on the back, mostly in dark, short-coated dogs in hot months [1].",
      "objective_id": "trauma-burns-01"
    },
    {
      "point": "Signs of heat exhaustion or heatstroke preceded the skin lesions in 4 of 16 dogs, so treat a burned dog from hot weather as a possible heat illness patient too (see the heat stroke module) [1].",
      "objective_id": "trauma-burns-02"
    }
  ],
  "content": {
    "recognition": [
      "Dorsal thermal necrosis: 15 of 16 cases occurred May to September in the southwestern USA; histology matched partial and full-thickness thermal burns [1].",
      "Most were treated supportively with analgesics and antimicrobials; most healed by second intention and 2 dogs had surgery [1].",
      "TODO: burn depth and surface-area estimation in dogs (no canine body-area chart retrieved; do not use the human rule of nines), fluid needs, cooling of an acute burn, and inhalation injury (see the smoke inhalation module)."
    ],
    "management": [
      "TODO: first aid for an acute thermal burn in a dog. No canine source retrieved. The reviewer decides scope; do not adapt human burn protocols.",
      "One nine-case series (5 dogs, 4 cats) reported healing with a vitamin-supplemented medical-grade honey product, but it was small, uncontrolled and some authors are affiliated with the product maker [2]. Not a recommendation."
    ],
    "procedure_refs": []
  },
  "lens": {
    "handler": {
      "do_here": [],
      "leave_for_next": [],
      "transfer_trigger": "TODO: reviewer to set"
    },
    "prehospital_als": {
      "do_here": [],
      "leave_for_next": [],
      "transfer_trigger": "TODO: reviewer to set"
    },
    "flight_cct": {
      "do_here": [],
      "leave_for_next": [],
      "transfer_trigger": "TODO: reviewer to set"
    },
    "human_ed": {
      "do_here": [],
      "leave_for_next": [],
      "transfer_trigger": "TODO: reviewer to set"
    },
    "vet_gp": {
      "do_here": [],
      "leave_for_next": [],
      "transfer_trigger": "TODO: reviewer to set"
    },
    "vet_ed": {
      "do_here": [],
      "leave_for_next": [],
      "transfer_trigger": "TODO: reviewer to set"
    }
  },
  "takeaway": "A dog burned by sun, fire or hot surfaces needs a veterinarian; check for heat illness and smoke inhalation too.",
  "sources": [
    {
      "rank": 3,
      "citation": "Schwartz SL et al. 2018. Dorsal thermal necrosis in dogs: a retrospective analysis of 16 cases in the southwestern USA (2009-2016). Vet Dermatol.",
      "url": "https://pubmed.ncbi.nlm.nih.gov/29392813/"
    },
    {
      "rank": 3,
      "citation": "Peteoacă A et al. 2026. Vitamin-supplemented medical-grade honey for burn wound management in cats and dogs: a retrospective case series. Open Vet J.",
      "url": "https://pubmed.ncbi.nlm.nih.gov/42375280/"
    }
  ],
  "drug_refs": []
}
