{
  "id": "heat-stroke",
  "title": "Heat stroke",
  "domain": "medical",
  "reversible": true,
  "status": "draft",
  "last_verified": null,
  "review_interval_months": 12,
  "signoff": {
    "vet": null,
    "physician": null
  },
  "why_this_matters": "Exertional hyperthermia is reported as one of the top three causes of death in working dogs [8], and mortality from heatstroke is around 50% despite early cooling and intensive care [7].",
  "what_changes_from_human": [
    {
      "point": "Dogs cool by panting; in the studies retrieved, water immersion or wet skin with airflow cooled dogs better than alcohol on the paw pads.",
      "objective_id": "medical-heat-stroke-01"
    },
    {
      "point": "Cool first, transport second: a dog's temperature can keep rising after exercise stops.",
      "objective_id": "medical-heat-stroke-02"
    }
  ],
  "content": {
    "recognition": [
      "Heatstroke is core temperature above 41 °C with central nervous system dysfunction in one review [7].",
      "Common signs: acute collapse, tachypnea, spontaneous bleeding, shock signs, and mental changes from depression and disorientation to seizures, stupor and coma [7].",
      "Risk factors: hot and humid conditions, strenuous exercise, obesity, body weight over 15 kg, Labrador retrievers, brachycephalic breeds, upper airway obstruction and prolonged seizures [7]."
    ],
    "management": [
      "Cool first, transport second [4][6].",
      "Partial water immersion cooled working dogs faster than passive cooling or a cooling mat [3], and more efficiently than alcohol on the paw pads [1].",
      "Cold water (0.1 to 15 °C) cooled dogs effectively with no hypothermia or adverse effects in one canicross study [4].",
      "Voluntary head dunking with limited water ingestion cooled dogs with normal mental status who could pause panting. It is not an option for a dog that cannot [2].",
      "Tap water or alcohol on hairless skin, combined with a fan, cooled dogs from early on [5].",
      "Cool the vehicle before loading and keep air moving around the dog during transport [4].",
      "TODO: source for the temperature at which to stop active cooling. The framework text says about 39.4 °C; no retrieved source states one."
    ],
    "procedure_refs": []
  },
  "lens": {
    "handler": {
      "do_here": [],
      "leave_for_next": [],
      "transfer_trigger": "TODO"
    },
    "prehospital_als": {
      "do_here": [],
      "leave_for_next": [],
      "transfer_trigger": "TODO"
    },
    "flight_cct": {
      "do_here": [],
      "leave_for_next": [],
      "transfer_trigger": "TODO"
    },
    "human_ed": {
      "do_here": [],
      "leave_for_next": [],
      "transfer_trigger": "TODO"
    },
    "vet_gp": {
      "do_here": [],
      "leave_for_next": [],
      "transfer_trigger": "TODO"
    },
    "vet_ed": {
      "do_here": [],
      "leave_for_next": [],
      "transfer_trigger": "TODO"
    }
  },
  "takeaway": "Start cooling on scene with water and airflow, protect the airway, and move the dog to a veterinarian.",
  "sources": [
    {
      "rank": 3,
      "citation": "Parnes SC et al. 2023. A randomized cross-over study comparing cooling methods for exercise-induced hyperthermia in working dogs in training. Animals.",
      "url": "https://doi.org/10.3390/ani13233673"
    },
    {
      "rank": 3,
      "citation": "Parnes SC et al. 2024. Voluntary head dunking after exercise-induced hyperthermia rapidly reduces core body temperature in dogs. J Am Vet Med Assoc.",
      "url": "https://doi.org/10.2460/javma.24.06.0368"
    },
    {
      "rank": 3,
      "citation": "Davis MS et al. 2019. Comparison of postexercise cooling methods in working dogs. J Spec Oper Med.",
      "url": "https://doi.org/10.55460/2ATZ-TMQ7"
    },
    {
      "rank": 3,
      "citation": "Carter AJ et al. 2024. Post-exercise management of exertional hyperthermia in dogs participating in dog sport (canicross) events in the UK. J Therm Biol.",
      "url": "https://doi.org/10.1016/j.jtherbio.2024.103827"
    },
    {
      "rank": 3,
      "citation": "Gillette RL et al. 2025. Evaluation of methods to reduce exercise-induced heat stress in working Labrador Retrievers. Am J Vet Res.",
      "url": "https://doi.org/10.2460/ajvr.25.06.0228"
    },
    {
      "rank": 3,
      "citation": "Hall EJ et al. 2023. Cooling methods used to manage heat-related illness in dogs presented to primary care veterinary practices during 2016-2018 in the UK. Vet Sci.",
      "url": "https://doi.org/10.3390/vetsci10070465"
    },
    {
      "rank": 3,
      "citation": "Bruchim Y et al. 2017. Pathophysiology of heatstroke in dogs, revisited. Temperature.",
      "url": "https://doi.org/10.1080/23328940.2017.1367457"
    },
    {
      "rank": 3,
      "citation": "Ramos M et al. 2023. Comparing cooling methods for exertional hyperthermia in working dogs (symposium abstract). ACVSMR Symposium.",
      "url": "https://consensus.app/papers/details/ff4679a37854573f8e80c36b6eee29d7/?utm_source=claude_desktop"
    }
  ],
  "drug_refs": []
}
