{
  "id": "anticoagulant-rodenticides",
  "title": "Anticoagulant rodenticides",
  "domain": "tox-common",
  "reversible": true,
  "status": "draft",
  "last_verified": null,
  "review_interval_months": 12,
  "signoff": {
    "vet": null,
    "physician": null
  },
  "why_this_matters": "Anticoagulant rodenticide poisoning is among the most common toxicoses in dogs and cats, and it is treatable when recognized [3].",
  "what_changes_from_human": [
    {
      "point": "Coagulation times can normalise within hours with IV vitamin K1, without plasma, in the retrospective series retrieved [1][3].",
      "objective_id": "tox-common-rodenticide-01"
    },
    {
      "point": "Response and treatment length vary with the dog and the agent, so treatment is individualized and coagulation is monitored [4].",
      "objective_id": "tox-common-rodenticide-02"
    }
  ],
  "content": {
    "recognition": [
      "Long-acting anticoagulant rodenticides inhibit vitamin K epoxide reductase, and related bleeding can be a diagnostic challenge (human review) [5].",
      "Plasma toxin concentration at presentation varied widely in a dog series, and some dogs with characteristic coagulation disturbances and a positive response to vitamin K1 had no detectable toxin [4]."
    ],
    "management": [
      "In 58 dogs and cats given IV lecithin-solubilised vitamin K1, no adverse effects were recorded and all had coagulation times within range by 24 hours. Survival to discharge in dogs was 96% without and 85% with exogenous coagulation factors, a difference that was not significant [1].",
      "In 4 dogs, IV vitamin K1 normalised prothrombin time within an hour, but 2 had suspected anaphylactoid reactions and treatment stopped in one. Monitor for reactions [2].",
      "IV mixed-micelle phytomenadione had no recorded adverse reactions in its group of dogs and cats, comparable survival and a shorter hospital stay than traditional therapy with blood products [3].",
      "In a dog series, the vitamin K1 dose was reduced stepwise while prothrombin time stayed normal, and the authors concluded an individual approach is warranted [4].",
      "TODO: canine vitamin K1 route, dose and treatment duration. The retrieved sources disagree on IV safety (reactions in one 4-dog series, none in two larger series) and give no canine duration for long-acting agents. Decision for the veterinary reviewer."
    ],
    "procedure_refs": []
  },
  "lens": {
    "handler": {
      "do_here": [],
      "leave_for_next": [],
      "transfer_trigger": "TODO"
    },
    "prehospital_als": {
      "do_here": [],
      "leave_for_next": [],
      "transfer_trigger": "TODO"
    },
    "flight_cct": {
      "do_here": [],
      "leave_for_next": [],
      "transfer_trigger": "TODO"
    },
    "human_ed": {
      "do_here": [],
      "leave_for_next": [],
      "transfer_trigger": "TODO"
    },
    "vet_gp": {
      "do_here": [],
      "leave_for_next": [],
      "transfer_trigger": "TODO"
    },
    "vet_ed": {
      "do_here": [],
      "leave_for_next": [],
      "transfer_trigger": "TODO"
    }
  },
  "takeaway": "Get the dog to a veterinarian, tell them the product if known, and expect coagulation to need monitoring after treatment starts.",
  "sources": [
    {
      "rank": 3,
      "citation": "Dartencet C et al. 2026. Intravenous administration of vitamin K1 in dogs and cats presented for anticoagulant rodenticide poisoning: a retrospective study of 58 cases. J Vet Emerg Crit Care.",
      "url": "https://pubmed.ncbi.nlm.nih.gov/?term=Intravenous%20Administration%20of%20Vitamin%20K1%20in%20Dogs%20and%20Cats%20Presented%20for%20Anticoagulant%20Rodenticide%20Poisoning%3A%20A%20Retrospective%20Study%20of%2058%20Cases"
    },
    {
      "rank": 3,
      "citation": "Mooney E et al. 2020. Intravenous vitamin K1 normalises prothrombin time in 1 hour in dogs with anticoagulant rodenticide toxicosis. Aust Vet J.",
      "url": "https://pubmed.ncbi.nlm.nih.gov/32189335/"
    },
    {
      "rank": 3,
      "citation": "Agostini G et al. 2025. Comparison of intravenous mixed micelle phytomenadione (vitamin K1) and traditional therapies for the treatment of anticoagulant rodenticide toxicosis in dogs and cats: a retrospective study. Aust Vet J.",
      "url": "https://pubmed.ncbi.nlm.nih.gov/40778568/"
    },
    {
      "rank": 3,
      "citation": "Robben JH et al. 1998. Plasma superwarfarin levels and vitamin K1 treatment in dogs with anticoagulant rodenticide poisoning. Vet Q.",
      "url": "https://pubmed.ncbi.nlm.nih.gov/9477532/"
    },
    {
      "rank": 3,
      "citation": "King N, Tran MH. 2015. Long-acting anticoagulant rodenticide (superwarfarin) poisoning: a review of its historical development, epidemiology, and clinical management (human data). Transfus Med Rev.",
      "url": "https://pubmed.ncbi.nlm.nih.gov/26239439/"
    }
  ],
  "drug_refs": []
}
