{
  "id": "respiratory-mechanics-and-oxygen-transport",
  "title": "Respiratory mechanics and oxygen transport",
  "domain": "pathophysiology",
  "reversible": false,
  "status": "draft",
  "last_verified": null,
  "review_interval_months": 24,
  "signoff": {
    "vet": null,
    "physician": null
  },
  "why_this_matters": "Oxygen readings, oxygen targets and chest findings do not transfer cleanly from human medicine to dogs: the dog's hemoglobin releases oxygen at a different pressure, and the textbook assumption about a dog's two pleural cavities is contested.",
  "what_changes_from_human": [
    {
      "point": "Dog hemoglobin has a higher P50 than human hemoglobin (28.8 vs 26.6 mmHg in one study) and varies widely by breed (25.8 to 35.8), so a pulse-oximeter reading corresponds to a different arterial oxygen pressure than a human table suggests.",
      "objective_id": "pathophys-resp-01"
    },
    {
      "point": "Whether a dog's pneumothorax stays on one side is disputed: a 39-dog experiment found disease stayed confined unless the mediastinum was injured, yet 5 of 6 dogs in a 2019 ultrasound series had pneumothorax on both sides.",
      "objective_id": "pathophys-resp-02"
    }
  ],
  "content": {
    "recognition": [],
    "management": [],
    "procedure_refs": []
  },
  "takeaway": "Do not read a dog's oxygen saturation or chest with human tables and assumptions: hemoglobin affinity varies by breed, and pneumothorax may be one-sided or two-sided.",
  "sources": [
    {
      "rank": 3,
      "citation": "Clerbaux T et al. 1993. Comparative study of the oxyhaemoglobin dissociation curve of four mammals: man, dog, horse and cattle. Comp Biochem Physiol Comp Physiol.",
      "url": "https://doi.org/10.1016/0300-9629(93)90382-e"
    },
    {
      "rank": 3,
      "citation": "von Recum AF. 1977. The mediastinum and hemothorax, pyothorax, and pneumothorax in the dog. J Am Vet Med Assoc.",
      "url": "https://pubmed.ncbi.nlm.nih.gov/914683/"
    },
    {
      "rank": 3,
      "citation": "Boysen S et al. 2019. Abnormal curtain signs identified with a novel lung ultrasound protocol in six dogs with pneumothorax. Front Vet Sci.",
      "url": "https://pubmed.ncbi.nlm.nih.gov/31555674/"
    },
    {
      "rank": 1,
      "citation": "Thawley VJ et al. 2026. RECOVER Guidelines: First Aid in Dogs and Cats. Evidence and knowledge gap analysis with treatment recommendations. J Vet Emerg Crit Care 36(Suppl 1):S3-S35.",
      "url": "https://pubmed.ncbi.nlm.nih.gov/42640821/"
    }
  ],
  "drug_refs": [],
  "kind": "pathophysiology",
  "compare": [
    {
      "topic": "Oxygen release from hemoglobin (P50)",
      "human": "Human P50 at pH 7.4, PCO2 40 mmHg and 37 C was 26.6 mmHg in the same study.",
      "canine": "Dog P50 was 28.8 mmHg on average, ranging by breed from 25.8 (spaniel) to 35.8 (hound). Red-cell 2,3-DPG was higher in the dog (19.4 vs 13.5 umol/g Hb) and the oxygen exchange fraction between PO2 80 and 35 mmHg was 6.6 vs 5.5 vol%.",
      "implication": "A human saturation-to-PaO2 conversion may misjudge a dog, more so in some breeds. Trust the trend and the whole dog, not one number. This is an inference from a single small comparison, not a validated correction.",
      "human_basis": "cited",
      "source_refs": [
        1
      ]
    },
    {
      "topic": "Pleural cavities and pneumothorax",
      "human": "The human mediastinum is a barrier, so a one-sided pneumothorax usually stays one-sided.",
      "canine": "Evidence conflicts. In 39 dogs, hemothorax, pyothorax or pneumothorax stayed in one pleural cavity unless the mediastinum was mechanically injured, contrary to earlier reports of communication. In a 2019 case series of 6 dogs with pneumothorax, 5 had it bilaterally (mixed traumatic and spontaneous causes).",
      "implication": "Do not assume a dog's pneumothorax is one-sided or two-sided. Assess both sides, and expect that treating one side may not relieve both.",
      "human_basis": "general-medical-knowledge",
      "source_refs": [
        2,
        3
      ]
    },
    {
      "topic": "Oxygen supplementation target",
      "human": "Adult oxygen targets are usually set in the mid-90s percent, with lower targets for some chronic lung disease.",
      "canine": "For dogs and cats with difficulty breathing or hypoxemia, the 2026 RECOVER first-aid guideline recommends oxygen during transport and, where monitoring exists, titrating to an SpO2 of 95 to 97% (strong recommendation, moderate quality evidence).",
      "implication": "The target is similar, but oximeter reliability on a haired, pigmented dog and in carbon monoxide exposure is limited; watch breathing effort as well as the number.",
      "human_basis": "general-medical-knowledge",
      "source_refs": [
        4
      ]
    }
  ]
}
