{
  "id": "status-epilepticus",
  "title": "Status epilepticus",
  "domain": "medical",
  "reversible": true,
  "status": "draft",
  "last_verified": null,
  "review_interval_months": 12,
  "signoff": {
    "vet": null,
    "physician": null
  },
  "why_this_matters": "Seizure emergencies are unlikely to stop on their own and become harder to treat the longer they last, with high morbidity and mortality [1][5].",
  "what_changes_from_human": [
    {
      "point": "Intranasal benzodiazepine by atomizer has been studied in dogs as a first-line option when IV access is not available [2][3].",
      "objective_id": "medical-status-01"
    },
    {
      "point": "Treat early: prolonged seizure activity becomes progressively more resistant to treatment [5].",
      "objective_id": "medical-status-02"
    }
  ],
  "content": {
    "recognition": [
      "Status epilepticus is broadly defined as seizures lasting more than 5 minutes, or multiple seizures without full recovery between them. Untreated, it can cause permanent brain damage and systemic complications (cardiorespiratory collapse, shock, acidosis), and complication risk rises with seizure duration [4].",
      "Overall mortality among dogs presenting with status epilepticus has been reported at 25.3 to 38.5%; about 0.5 to 2.6% of dogs admitted to emergency hospitals have it [4]."
    ],
    "management": [
      "Benzodiazepines are the first-line drugs for canine status epilepticus and cluster seizures [1][4].",
      "An ACVIM consensus statement recommends an early, rapid, stage-based approach, with management of complications and underlying causes alongside seizure medication [1].",
      "In a randomized trial in dogs in status epilepticus before IV access, intranasal midazolam by atomizer stopped seizures in 14 of 20 dogs versus 3 of 15 with rectal diazepam [2].",
      "Intranasal and intravenous midazolam had similar success (76% and 61%), and intranasal was faster when the time to place an IV catheter was counted [3].",
      "In the 2021 review's assessment, intranasal midazolam is likely an effective and safe first choice at home and in hospital, especially when IV access has not been established; rectal diazepam is unlikely to be as effective [4].",
      "Rectal diazepam stopped status epilepticus in about 20% of dogs versus about 70% with intranasal midazolam in one open-label trial [4].",
      "When time to place an IV catheter was counted, the IV route was slower: median seizure cessation 1 minute (IV) versus 0.5 minutes (intranasal), with 4.5 minutes to establish IV access versus 1.6 minutes to give the intranasal dose [4].",
      "Intramuscular, buccal and sublingual benzodiazepines have no clinical trials in dogs, only pharmacokinetic data; the review calls their evidence insufficient and notes bite risk to owners. Diazepam is not advised intramuscularly because of erratic absorption [4].",
      "In two canine trials, intranasal midazolam worked across breeds including brachycephalic dogs; difficulty applying the atomizer occurred in under 24% of dogs and was linked to unfamiliar staff. No intranasal device designed for dogs exists; trials used a human mucosal atomization device [4].",
      "Only diazepam is licensed for small animals; midazolam use is off-label [4].",
      "Sedation and ataxia were common after benzodiazepine treatment [2][3].",
      "In an owner survey, intranasal midazolam was perceived as more effective than rectal diazepam. This is owner perception, not a trial [5].",
      "TODO: the stage-based algorithm and second-line drugs from the ACVIM consensus full text (not retrieved), and the canine benzodiazepine drug and dose chosen by the veterinary reviewer. The 2021 review lists dose ranges; they are recorded in research/status-epilepticus.md and are not adopted here."
    ],
    "procedure_refs": []
  },
  "lens": {
    "handler": {
      "do_here": [],
      "leave_for_next": [],
      "transfer_trigger": "TODO"
    },
    "prehospital_als": {
      "do_here": [],
      "leave_for_next": [],
      "transfer_trigger": "TODO"
    },
    "flight_cct": {
      "do_here": [],
      "leave_for_next": [],
      "transfer_trigger": "TODO"
    },
    "human_ed": {
      "do_here": [],
      "leave_for_next": [],
      "transfer_trigger": "TODO"
    },
    "vet_gp": {
      "do_here": [],
      "leave_for_next": [],
      "transfer_trigger": "TODO"
    },
    "vet_ed": {
      "do_here": [],
      "leave_for_next": [],
      "transfer_trigger": "TODO"
    }
  },
  "takeaway": "Treat a seizing dog early with a benzodiazepine, do not wait for IV access if an intranasal route is available, and get the dog to a veterinarian.",
  "sources": [
    {
      "rank": 2,
      "citation": "Charalambous M et al. 2023. ACVIM Consensus Statement on the management of status epilepticus and cluster seizures in dogs and cats. J Vet Intern Med.",
      "url": "https://pubmed.ncbi.nlm.nih.gov/37921621/"
    },
    {
      "rank": 3,
      "citation": "Charalambous M et al. 2017. Intranasal midazolam versus rectal diazepam for the management of canine status epilepticus: a multicenter randomized parallel-group clinical trial. J Vet Intern Med.",
      "url": "https://pubmed.ncbi.nlm.nih.gov/28543780/"
    },
    {
      "rank": 3,
      "citation": "Charalambous M et al. 2019. Comparison of intranasal versus intravenous midazolam for management of status epilepticus in dogs: a multi-center randomized parallel group clinical study. J Vet Intern Med.",
      "url": "https://pubmed.ncbi.nlm.nih.gov/31580527/"
    },
    {
      "rank": 3,
      "citation": "Charalambous M et al. 2021. First-line management of canine status epilepticus at home and in hospital: opportunities and limitations of the various administration routes of benzodiazepines. BMC Vet Res.",
      "url": "https://pubmed.ncbi.nlm.nih.gov/33663513/"
    },
    {
      "rank": 3,
      "citation": "Kähn et al. 2023. Out-of-hospital rescue medication in dogs with emergency seizure disorders: an owner perspective. Front Vet Sci.",
      "url": "https://pubmed.ncbi.nlm.nih.gov/37850066/"
    }
  ],
  "drug_refs": []
}
