{
  "id": "blood-chemistry-and-acid-base-reference-ranges",
  "title": "Blood chemistry and acid-base reference ranges",
  "domain": "pathophysiology",
  "reversible": false,
  "status": "draft",
  "last_verified": null,
  "review_interval_months": 24,
  "signoff": {
    "vet": null,
    "physician": null
  },
  "why_this_matters": "A point-of-care blood result can look abnormal or normal by human ranges for the wrong reasons: puppies, sighthound breeds and the type of collection tube all change what is normal for a dog.",
  "what_changes_from_human": [
    {
      "point": "Adult reference intervals should not be used for puppies: in 68 healthy puppies sodium, chloride and ionized magnesium were lower than adult values, potassium and ionized calcium higher, and glucose above adult values after day 4.",
      "objective_id": "pathophys-chem-01"
    },
    {
      "point": "Breed matters: Galgos Espanoles (Spanish greyhounds) had higher hematocrit, hemoglobin, red cell count and pH and lower platelets than other dogs, so a sighthound's numbers can look abnormal but be normal for the breed.",
      "objective_id": "pathophys-chem-02"
    },
    {
      "point": "Collection method matters: in 51 dogs, results from a heparin tube differed significantly from a blood gas syringe for pH, PCO2, PO2, bicarbonate, lactate, anion gap and ionized calcium, but not for sodium, potassium, chloride or glucose.",
      "objective_id": "pathophys-chem-03"
    }
  ],
  "content": {
    "recognition": [
      "Reference intervals for traditional and Stewart-approach acid-base values in venous and arterial blood from 224 healthy dogs have been published; the numbers were not in the abstract and are not entered here [4].",
      "TODO: canine reference values for creatinine, urea, electrolytes and blood gas from a source the veterinary reviewer selects; species-level kidney comparison (dog vs human) has no retrieved source."
    ],
    "management": [],
    "procedure_refs": []
  },
  "takeaway": "Do not read a dog's blood work with adult human ranges: age, breed and how the sample was collected all move the numbers; hand off the raw values and the method.",
  "sources": [
    {
      "rank": 3,
      "citation": "O'Brien MA et al. 2014. Reference intervals and age-related changes for venous biochemical, hematological, electrolytic, and blood gas variables using a point of care analyzer in 68 puppies. J Vet Emerg Crit Care.",
      "url": "https://doi.org/10.1111/vec.12162"
    },
    {
      "rank": 3,
      "citation": "Mesa-Sanchez I et al. 2012. Haematological, blood gas and acid-base values in the Galgo Espanol (Spanish greyhound). J Small Anim Pract.",
      "url": "https://doi.org/10.1111/j.1748-5827.2012.01235.x"
    },
    {
      "rank": 3,
      "citation": "Bachmann K et al. 2018. Determination of reference intervals and comparison of venous blood gas parameters using a standard and nonstandard collection method in 51 dogs. Schweiz Arch Tierheilkd.",
      "url": "https://doi.org/10.17236/sat00150"
    },
    {
      "rank": 3,
      "citation": "Vanova-Uhrikova I et al. 2017. Determination of reference intervals of acid-base parameters in clinically healthy dogs. J Vet Emerg Crit Care.",
      "url": "https://doi.org/10.1111/vec.12589"
    }
  ],
  "drug_refs": [],
  "kind": "pathophysiology",
  "compare": [
    {
      "topic": "Age",
      "human": "Human laboratory ranges are also age-dependent, and pediatric ranges differ from adult ranges.",
      "canine": "In 68 healthy puppies tested from 4 to 84 days old, pH and bicarbonate were closest to adult values. Sodium, chloride and ionized magnesium were lower and potassium and ionized calcium higher than adult values at all time points. Glucose was similar on day 4 but above adult values afterwards. Blood urea nitrogen was higher until day 28, then lower than in adults through day 84.",
      "implication": "Do not apply adult dog or human adult ranges to a puppy; a normal puppy can look hyperglycemic or low in sodium.",
      "human_basis": "general-medical-knowledge",
      "source_refs": [
        1
      ]
    },
    {
      "topic": "Breed (sighthounds)",
      "human": "Human reference ranges do not depend on breed.",
      "canine": "In 30 Galgos Espanoles compared with 20 dogs of other breeds, 5 of 24 parameters differed: higher hematocrit, hemoglobin, erythrocyte count and pH, and lower platelet count. The authors note differences are less striking than in greyhounds.",
      "implication": "A sighthound can have a high hematocrit that would suggest dehydration or polycythemia in another breed. Compare with breed norms if known.",
      "human_basis": "general-medical-knowledge",
      "source_refs": [
        2
      ]
    },
    {
      "topic": "Sample collection for acid-base",
      "human": "Arterial or venous gas samples are usually collected anaerobically in a blood gas syringe.",
      "canine": "In 51 healthy dogs, immediate analysis of lithium heparin tube samples matched blood gas syringe samples for standard bicarbonate, base excess, sodium, potassium, chloride, glucose and hemoglobin, but pH, PCO2, PO2, actual bicarbonate, extracellular base excess, ionized calcium, anion gap and lactate differed significantly.",
      "implication": "If the tube type is not a blood gas syringe, say so in the handoff; pH, lactate and ionized calcium may be biased.",
      "human_basis": "general-medical-knowledge",
      "source_refs": [
        3
      ]
    }
  ]
}
